
Testing model: checkpoints/20260101_032252/best_model.pth
Running 100 simulation episodes (seeds 0-99)
Mode: HEADLESS | Max steps: 20000
Success criteria: obj_dist < 0.1m AND ee_dist > 0.1m

Run   1/100 (seed=  0): SUCCESS (steps:  7086, obj_dist: 0.074m, ee_dist: 0.100m)
Run   2/100 (seed=  1): FAILURE (steps: 20000, obj_dist: 0.762m, ee_dist: 0.207m)
Run   3/100 (seed=  2): SUCCESS (steps:  5021, obj_dist: 0.039m, ee_dist: 0.100m)
Run   4/100 (seed=  3): FAILURE (steps: 20000, obj_dist: 1.672m, ee_dist: 2.081m)
Run   5/100 (seed=  4): FAILURE (steps: 20000, obj_dist: 0.111m, ee_dist: 0.367m)
Run   6/100 (seed=  5): SUCCESS (steps: 10007, obj_dist: 0.047m, ee_dist: 0.101m)
Run   7/100 (seed=  6): FAILURE (steps: 20000, obj_dist: 0.892m, ee_dist: 0.536m)
Run   8/100 (seed=  7): SUCCESS (steps:  3130, obj_dist: 0.043m, ee_dist: 0.101m)
Run   9/100 (seed=  8): FAILURE (steps: 20000, obj_dist: 0.756m, ee_dist: 0.083m)
Run  10/100 (seed=  9): FAILURE (steps: 20000, obj_dist: 0.722m, ee_dist: 0.377m)
Run  11/100 (seed= 10): SUCCESS (steps:  8942, obj_dist: 0.070m, ee_dist: 0.100m)
Run  12/100 (seed= 11): SUCCESS (steps:  6247, obj_dist: 0.075m, ee_dist: 0.100m)
Run  13/100 (seed= 12): FAILURE (steps: 20000, obj_dist: 0.637m, ee_dist: 0.351m)
Run  14/100 (seed= 13): SUCCESS (steps:  1568, obj_dist: 0.024m, ee_dist: 0.101m)
Run  15/100 (seed= 14): SUCCESS (steps: 15077, obj_dist: 0.098m, ee_dist: 0.229m)
Run  16/100 (seed= 15): SUCCESS (steps: 14030, obj_dist: 0.015m, ee_dist: 0.100m)
Run  17/100 (seed= 16): FAILURE (steps: 20000, obj_dist: 0.818m, ee_dist: 0.543m)
Run  18/100 (seed= 17): SUCCESS (steps:  3482, obj_dist: 0.019m, ee_dist: 0.101m)
Run  19/100 (seed= 18): SUCCESS (steps:  2929, obj_dist: 0.100m, ee_dist: 0.163m)
Run  20/100 (seed= 19): FAILURE (steps: 20000, obj_dist: 0.761m, ee_dist: 0.319m)
Run  21/100 (seed= 20): FAILURE (steps: 20000, obj_dist: 0.417m, ee_dist: 0.396m)
Run  22/100 (seed= 21): SUCCESS (steps: 10161, obj_dist: 0.100m, ee_dist: 0.186m)
Run  23/100 (seed= 22): FAILURE (steps: 20000, obj_dist: 0.596m, ee_dist: 0.313m)
Run  24/100 (seed= 23): FAILURE (steps: 20000, obj_dist: 1.899m, ee_dist: 1.498m)
Run  25/100 (seed= 24): FAILURE (steps: 20000, obj_dist: 0.564m, ee_dist: 0.127m)
Run  26/100 (seed= 25): SUCCESS (steps:  2740, obj_dist: 0.018m, ee_dist: 0.101m)
Run  27/100 (seed= 26): FAILURE (steps: 20000, obj_dist: 0.234m, ee_dist: 0.243m)
Run  28/100 (seed= 27): SUCCESS (steps:     1, obj_dist: 0.098m, ee_dist: 0.511m)
Run  29/100 (seed= 28): SUCCESS (steps:  5529, obj_dist: 0.022m, ee_dist: 0.101m)
Run  30/100 (seed= 29): FAILURE (steps: 20000, obj_dist: 0.347m, ee_dist: 0.364m)
Run  31/100 (seed= 30): SUCCESS (steps:  7499, obj_dist: 0.036m, ee_dist: 0.100m)
Run  32/100 (seed= 31): FAILURE (steps: 20000, obj_dist: 0.443m, ee_dist: 0.167m)
Run  33/100 (seed= 32): FAILURE (steps: 20000, obj_dist: 0.784m, ee_dist: 0.256m)
Run  34/100 (seed= 33): FAILURE (steps: 20000, obj_dist: 0.178m, ee_dist: 0.426m)
Run  35/100 (seed= 34): FAILURE (steps: 20000, obj_dist: 0.693m, ee_dist: 0.189m)
Run  36/100 (seed= 35): FAILURE (steps: 20000, obj_dist: 0.327m, ee_dist: 0.596m)
Run  37/100 (seed= 36): SUCCESS (steps:  4581, obj_dist: 0.066m, ee_dist: 0.103m)
Run  38/100 (seed= 37): SUCCESS (steps: 13784, obj_dist: 0.015m, ee_dist: 0.101m)
Run  39/100 (seed= 38): FAILURE (steps: 20000, obj_dist: 0.213m, ee_dist: 0.401m)
Run  40/100 (seed= 39): SUCCESS (steps:  6287, obj_dist: 0.090m, ee_dist: 0.100m)
Run  41/100 (seed= 40): SUCCESS (steps:  1493, obj_dist: 0.017m, ee_dist: 0.101m)
Run  42/100 (seed= 41): SUCCESS (steps: 18439, obj_dist: 0.018m, ee_dist: 0.101m)
Run  43/100 (seed= 42): FAILURE (steps: 20000, obj_dist: 0.668m, ee_dist: 0.259m)
Run  44/100 (seed= 43): FAILURE (steps: 20000, obj_dist: 0.773m, ee_dist: 0.499m)
Run  45/100 (seed= 44): SUCCESS (steps:  1932, obj_dist: 0.080m, ee_dist: 0.101m)
Run  46/100 (seed= 45): FAILURE (steps: 20000, obj_dist: 0.958m, ee_dist: 0.393m)
Run  47/100 (seed= 46): SUCCESS (steps: 17332, obj_dist: 0.021m, ee_dist: 0.101m)
Run  48/100 (seed= 47): SUCCESS (steps:  1666, obj_dist: 0.018m, ee_dist: 0.101m)
Run  49/100 (seed= 48): SUCCESS (steps: 14813, obj_dist: 0.092m, ee_dist: 0.101m)
Run  50/100 (seed= 49): SUCCESS (steps:  7527, obj_dist: 0.067m, ee_dist: 0.101m)
Run  51/100 (seed= 50): FAILURE (steps: 20000, obj_dist: 0.892m, ee_dist: 0.798m)
Run  52/100 (seed= 51): FAILURE (steps: 20000, obj_dist: 0.526m, ee_dist: 0.339m)
Run  53/100 (seed= 52): FAILURE (steps: 20000, obj_dist: 0.732m, ee_dist: 0.410m)
Run  54/100 (seed= 53): SUCCESS (steps:  1996, obj_dist: 0.024m, ee_dist: 0.102m)
Run  55/100 (seed= 54): FAILURE (steps: 20000, obj_dist: 1.113m, ee_dist: 0.955m)
Run  56/100 (seed= 55): FAILURE (steps: 20000, obj_dist: 0.398m, ee_dist: 0.291m)
Run  57/100 (seed= 56): SUCCESS (steps:  8092, obj_dist: 0.020m, ee_dist: 0.100m)
Run  58/100 (seed= 57): SUCCESS (steps:  2182, obj_dist: 0.016m, ee_dist: 0.101m)
Run  59/100 (seed= 58): FAILURE (steps: 20000, obj_dist: 0.582m, ee_dist: 0.264m)
Run  60/100 (seed= 59): FAILURE (steps: 20000, obj_dist: 0.604m, ee_dist: 0.244m)
Run  61/100 (seed= 60): SUCCESS (steps:  2527, obj_dist: 0.067m, ee_dist: 0.100m)
Run  62/100 (seed= 61): SUCCESS (steps: 11675, obj_dist: 0.099m, ee_dist: 0.126m)
Run  63/100 (seed= 62): SUCCESS (steps:  1790, obj_dist: 0.019m, ee_dist: 0.101m)
Run  64/100 (seed= 63): FAILURE (steps: 20000, obj_dist: 0.672m, ee_dist: 0.211m)
Run  65/100 (seed= 64): SUCCESS (steps:  2941, obj_dist: 0.029m, ee_dist: 0.100m)
Run  66/100 (seed= 65): FAILURE (steps: 20000, obj_dist: 0.342m, ee_dist: 0.368m)
Run  67/100 (seed= 66): FAILURE (steps: 20000, obj_dist: 0.183m, ee_dist: 0.639m)
Run  68/100 (seed= 67): FAILURE (steps: 20000, obj_dist: 0.736m, ee_dist: 0.494m)
Run  69/100 (seed= 68): FAILURE (steps: 20000, obj_dist: 0.406m, ee_dist: 0.288m)
Run  70/100 (seed= 69): SUCCESS (steps:  5061, obj_dist: 0.056m, ee_dist: 0.102m)
Run  71/100 (seed= 70): SUCCESS (steps:  2447, obj_dist: 0.083m, ee_dist: 0.101m)
Run  72/100 (seed= 71): SUCCESS (steps:  3404, obj_dist: 0.063m, ee_dist: 0.100m)
Run  73/100 (seed= 72): FAILURE (steps: 20000, obj_dist: 0.191m, ee_dist: 0.597m)
Run  74/100 (seed= 73): SUCCESS (steps:  8286, obj_dist: 0.044m, ee_dist: 0.100m)
Run  75/100 (seed= 74): FAILURE (steps: 20000, obj_dist: 0.234m, ee_dist: 0.210m)
Run  76/100 (seed= 75): FAILURE (steps: 20000, obj_dist: 0.605m, ee_dist: 0.441m)
Run  77/100 (seed= 76): FAILURE (steps: 20000, obj_dist: 0.269m, ee_dist: 0.234m)
Run  78/100 (seed= 77): FAILURE (steps: 20000, obj_dist: 1.359m, ee_dist: 0.639m)
Run  79/100 (seed= 78): SUCCESS (steps:  2770, obj_dist: 0.098m, ee_dist: 0.113m)
Run  80/100 (seed= 79): SUCCESS (steps: 13245, obj_dist: 0.077m, ee_dist: 0.100m)
Run  81/100 (seed= 80): SUCCESS (steps:  1288, obj_dist: 0.083m, ee_dist: 0.101m)
Run  82/100 (seed= 81): FAILURE (steps: 20000, obj_dist: 0.800m, ee_dist: 0.280m)
Run  83/100 (seed= 82): FAILURE (steps: 20000, obj_dist: 0.401m, ee_dist: 0.159m)
Run  84/100 (seed= 83): SUCCESS (steps:  3789, obj_dist: 0.050m, ee_dist: 0.100m)
Run  85/100 (seed= 84): FAILURE (steps: 20000, obj_dist: 0.686m, ee_dist: 0.376m)
Run  86/100 (seed= 85): FAILURE (steps: 20000, obj_dist: 0.529m, ee_dist: 0.751m)
Run  87/100 (seed= 86): FAILURE (steps: 20000, obj_dist: 0.584m, ee_dist: 0.202m)
Run  88/100 (seed= 87): SUCCESS (steps:  2619, obj_dist: 0.065m, ee_dist: 0.101m)
Run  89/100 (seed= 88): FAILURE (steps: 20000, obj_dist: 0.318m, ee_dist: 0.425m)
Run  90/100 (seed= 89): FAILURE (steps: 20000, obj_dist: 0.816m, ee_dist: 0.452m)
Run  91/100 (seed= 90): FAILURE (steps: 20000, obj_dist: 0.499m, ee_dist: 0.264m)
Run  92/100 (seed= 91): FAILURE (steps: 20000, obj_dist: 0.533m, ee_dist: 0.945m)
Run  93/100 (seed= 92): FAILURE (steps: 20000, obj_dist: 0.896m, ee_dist: 0.231m)
Run  94/100 (seed= 93): SUCCESS (steps:  8752, obj_dist: 0.100m, ee_dist: 0.178m)
Run  95/100 (seed= 94): SUCCESS (steps:  2194, obj_dist: 0.046m, ee_dist: 0.100m)
Run  96/100 (seed= 95): SUCCESS (steps:  2967, obj_dist: 0.058m, ee_dist: 0.100m)
Run  97/100 (seed= 96): SUCCESS (steps:  7259, obj_dist: 0.029m, ee_dist: 0.100m)
Run  98/100 (seed= 97): SUCCESS (steps:  6355, obj_dist: 0.100m, ee_dist: 0.156m)
Run  99/100 (seed= 98): FAILURE (steps: 20000, obj_dist: 0.338m, ee_dist: 0.402m)
Run 100/100 (seed= 99): FAILURE (steps: 20000, obj_dist: 0.418m, ee_dist: 0.152m)

======================================================================
                               RESULTS                                
======================================================================
Successful runs:       47 / 100  (47.0%)
Failed runs:           53 / 100  (53.0%)

Success statistics:
  - Average steps:    6232.8 ± 4679.0
  - Median steps:     5021
  - Min/Max steps:    1 / 18439

Failure statistics:
  - Average final obj distance:  0.621m ± 0.344m
  - Average final ee distance:   0.435m ± 0.333m

Seed range: 0-99
======================================================================

Results saved to: test_results/20260101_032252_results.json
